,0
0,all your problems to watch ipl matches can be solved within mins buy g season p
1,win one of these iphonex iphone just retweet follow us comment the one you want giveaway phone
2,y all see what a iphone can do prom k
3,rt iphone x space grey apple iphonex ios iphonephotography iphone plus iphone iphone plus iphone macbook macbookp
4,im playing fortnite on my iphone the future is now
5,win one of these iphonex iphone just retweet follow us comment the one you want giveaway phone
6,iphone
7,win one of these iphonex iphone just retweet follow us comment the one you want giveaway phone
8,rt iphone just launched competition retweet follow me iphone for chance to winiphone giveawayiphone good luck https
9,win one of these iphonex amp iphone just retweet amp follow us comment the one you want giveaway phone
10,good evening from mexico mexico vacation moon full moon iphone plus no filter
11,rt my first iphone giveaway win the brand new iphone iphone plus to win just retweet this post follow us winners w
12,win one of these iphonex iphone just retweet follow us comment the one you want giveaway phone
13,floral leopardo d bling swarovski crystal iphone and iphone plus case brown iphone iphonex blingbling
14,iphone
15,iphone in my pocket wit no case i shoulda juss dropped it
16,iphone
17,after a couple of months of use think i can say with some certainty that the iphone is a pos makes me long for
18,good night twitter guys anyone who has a dream to win a ps or an iphone of gracas just click on this link
19,rt for jk b g page iphone iphonex premiosmtvmiaw mtvbrkpopbts
20,rt win one of these iphonex iphone just retweet follow us comment the one you want giveaway phone
21,win one of these iphonex iphone just retweet follow us comment the one you want giveaway phone
22,rob skywalker and dr funk himself mainsqueeze funk iphone terminal west
23,the most unique bath light app ever ofuro dsp newappstore
24,win one of these iphonex iphone just retweet follow us comment the one you want giveaway phone
25,rt swimming with the elnido palawan philippines i ll post the video with jellyfish and seaturtles on my youtube ipho
26,rt win one of these iphonex amp iphone just retweet amp follow us comment the one you want giveaway phone
27,airborne one pyramid giza egypt skydiving iphone vsco
28,adidas iphone case available for iphone s iphone s and iphone galaxycommunications iphone iphone
29,happy flight mr president pyramid giza egypt skydiving iphone vsco
30,rt setup apple watch on your new iphone applewatch iphonex applewatchseries iphone iphone
31,setup apple watch on your new iphone applewatch iphonex applewatchseries iphone iphone
32,google s pixel can beat apple and samsung with these features newtech cuttingedge
33,win one of these iphonex iphone just retweet follow us comment the one you want giveaway phone
34,definitely not your grandfathers camo check out all the vibrant camo designs today be sure to signup at
35,cloud sky iphone wallpaper
36,only million iphone x units will be manufactured in q report iphonex iphone
37,rt icloud remove activation lock free solution server unlock iphone amsterdam nederlands
38,win one of these iphonex iphone just retweet follow us comment the one you want giveaway phone
39,iphone cpas centimes
40,for all you iridescent lovers casemate iphonex iridescent toughlove iphonex iridescent toughlove
41,rt check out aliceinwonderland black hard case fitted cover iphone iphone iphone iphone plus apple
42,iphone
43,i want that red iphone
44,win one of these iphonex iphone just retweet follow us comment the one you want giveaway phone h
45,hey here s my airtel g selfie hope to win the iphone get clicking guys tags
46,baseball cases for iphone s plus iphone iphonex
47,win one of these iphonex iphone just retweet follow us comment the one you want giveaway phone
48,cult of mac magazine who is apple s best ceo ever iphone
49,rt code t gives you off on buynow discount discountcode sales iphone iphonex iphone
50,got an iphone and set up applepay by registering some credit cards in it i dropped in on the nearest eleven t
51,floral ribbon d bling swarovski crystal iphone and iphone plus case purple iphone iphonex blingbling c
52,shop for latest iphone now choose from a selected range for you just visit iphone apple
53,apple s iphone and iphone plus product red editions are now available for purchase in india readmore
54,win one of these iphonex iphone just retweet follow us comment the one you want giveaway phone
55,smartphone wallpaper info landscape trees black and white iphone wallpaper
56,item specifics condition new a brand new unused unopened undamaged item in its
57,for iphone x s iphone plus shockproof hybrid bumper slim case cover item specifics
58,win one of these iphonex iphone just retweet follow us comment the one you want giveaway phone
59,rt yootech smart wirelesscharger pad for iphone iphonex samsung galaxy see details
60,win one of these iphonex iphone just retweet follow us comment the one you want giveaway phone u
61,you also can win iphone every day with clicking your selfie with airtel g card t onairtel g g
62,rt me are you participating in our annualsurvey don t miss the chance to win an iphone enter from here
63,win one of these iphonex iphone just retweet follow us comment the one you want giveaway phone
64,rt iphone x giveaway like retweet follow me comment your full adress and why you want iphone retweet iphone follow
65,join leading mobile appdevelopment company offering android iphone custom mobileapp development services
66,win one of these iphonex iphone just retweet follow us comment the one you want giveaway phone
67,pdca iphone ionic newapp it is pocketpdca that you can use easily pdca cycle on your smartphone
68,leo bling swarovski crystal iphone and iphone plus case iphone iphonex blingbling click here
69,apple iphone iphone plus product red special edition launched in india iphone iphone plus product red
70,wondering how to sync google photos with icloud photo library apple ios icloud iphone
71,win one of these iphonex iphone just retweet follow us comment the one you want giveaway phone
72,this is my airtel g t onairtel g selfie an amazing contest by guys do participate to win an
73,iphone red vs apple watch series lte flashfly iphone applewatchseries lte
74,rt this is my airtel g t onairtel g selfie share your selfies too guys an iphone is up for grabs hey
75,pdca iphone ionic newapp it is pocketpdca that you can use easily pdca cycle on your smartphone youtube
76,smartphone wallpaper info ground keyboard orange white iphone wallpaper
77,rt apple iphone and plus product red edition launched in india price starts at rs iphone
78,ground keyboard orange white iphone wallpaper
79,rt download icamtranslator free on your iphone and subscribe any feature and get a chance to win iphone ios apps
80,rt cherished here is my selfie with g t cricket season pass i really hope to win iphone all you guys participate
81,win one of these iphonex iphone just retweet follow us comment the one you want giveaway phone
82,win an iphone every day t onairtel g
83,apple iphone and plus product red edition launched in india price starts at rs iphone
84,this is my airtel g t onairtel g selfie hope to win iphone guys participate in the contest now don t
85,floral butterfly d bling swarovski crystal iphone and iphone plus case blue iphone iphonex blingbling
86,are you participating in our annualsurvey don t miss the chance to win an iphone enter from here
87,daily apps news is out iphone iphone
88,here is my selfie with g t cricket season pass i really hope to win iphone all you guys partici
89,here is my selfie with g for t cricket season pass hey sha
90,apple iphone iphone plus product red special edition now available in india starting at rs
91,iphone engineered to resist water dust unbox your iphone at imagine apple premium reseller call
92,cook my new iphone is not working purchased on th april only dealer is not helping m
93,happy weekend here is my selfie with g t cricket season pass hope to win iphone go partici
94,rt preorder soft case donald duck friends iphone s iphone s iphone iphone
95,rt dez everything is ready shipment will begin soon westbrook iphone iphonex apple design productdesign kickstarter in
96,preorder soft case donald duck friends iphone s iphone s iphone iphone
97,everything is ready shipment will begin soon westbrook iphone iphonex apple design productdesign
98,enuosuma wireless charger qi wireless charging pad for iphone x iphone plus galaxy s s s edge s edge note
99,win one of these iphonex iphone just retweet follow us comment the one you want giveaway phone
100,rt novu gif keyboard featured in actualapple apple ios iphonex iphone applewatch ipad
101,rt paid iphone apps you can download for free today ios iphonex iphone ipad applewatch
102,baseus headphone adapter support charger for iphone cable for lightning earphone fast charging and music for ipho
103,selene iphone
104,win one of these iphonex iphone just retweet follow us comment the one you want giveaway phone
105,rt new iphone concept iphone iphone apple teamapple appleiphone iphonex iphone plus iphone iphone plus iphone ap
106,win one of these iphonex iphone just retweet follow us comment the one you want giveaway phone
107,blossom bling swarovski crystal samsung galaxy s i cases black iphone iphonex blingbling click here
108,rt lmao johny will be giving away a red iphone keep checking his ig guys
109,gradation yellow iphone wallpaper
110,rt setup apple watch on your new iphone applewatch iphonex applewatchseries iphone iphone techn
111,rt setup apple watch on your new iphone applewatch iphonex
112,setup apple watch on your new iphone applewatch iphonex applewatchseries iphone iphone technology
113,not your traditional american flag design but none the less still pretty epic be sure to signup at
114,rt retweet if you wish this were real iphone ios scottforstall stevejobs legacy
115,code t gives you off on buynow discount discountcode sales iphone iphonex
116,rt code ioanna gives you off at offer valid until headphones earphones iphone iph
117,win one of these iphonex iphone just retweet follow us comment the one you want giveaway phone
118,classic crystal new ipad case pink iphone iphonex blingbling click here
119,apples product red editions of iphone and iphone plus are finally available for sale in india iphone
120,elephant wireless charger contact roc com promotionalproducts promo wirelesschargers
121,five useful mac apps worth checking out april iphone
122,rt giveaways just saw this on amazon nuans rolldock lightning mobile battery dock for via
123,rt belkin has unveiled its new wireless charging pad for iphone iphone plus and iphonex
124,win one of these iphonex iphone just retweet follow us comment the one you want giveaway phone
125,apple working on wireless ar vr headset with dual k displays iphone
126,smartphone wallpaper info cloudy green iphone wallpaper
127,cloudy green iphone wallpaper
128,win one of these iphonex iphone just retweet follow us comment the one you want giveaway phone
129,apple iphone and plus red special edition now available in india
130,ask and it shall be given on to you seen what you like don t hesitate to dm or call let s
131,new iphone concept iphone iphone apple teamapple appleiphone iphonex iphone plus iphone iphone plus
132,win one of these iphonex iphone just retweet follow us comment the one you want giveaway phone
133,how to add trusted phone numbers for two factor authentication to your apple id account iphone
134,download icamtranslator free on your iphone and subscribe any feature and get a chance to win iphone ios
135,rt iphonex cases apply any design any case brand apple phone phonecases online google
136,win one of these iphonex iphone just retweet follow us comment the one you want giveaway phone
137,matchy matchy blush elementalcases applewatch iphonex iphone plus iphone iphone plus iphone
138,rt sprint deal new iphone product red special edition iphone plus iphone iphone s iphonex iphone iphonegraphy i
139,iphone iphone plus product red hit india
140,powstro usb rechargeable battery levels selfie led phone camera ring light for iphone samsung r
141,rt pretty case in my casetify shop butterfly butterflies moths casetifyartist iphone summer trend iphone iphone
142,pasoundworks is an authorized telus dealer right now with telus you can trade in select phones and get up to
143,iphone gold
144,win one of these iphonex iphone just retweet follow us comment the one you want giveaway phone
145,smartphone wallpaper info mont saint michel light up iphone wallpaper
146,iphone fortnite v bucks giveaway trophies
147,mont saint michel light up iphone wallpaper
148,ukulele wireless charger contact us roc com promotionalproducts promo wirelesschargers
149,tech talks oneplus leaks iphone iphone plus red color xiaomi blackshark gaming
150,microsoft xl had face recognition before iphone imagine it come in and it still works like a brand new
151,rt bestand in airpods apple watch iphone stand iphone applewatch
152,win one of these iphonex amp iphone just retweet amp follow us comment the one y
153,rt iphone is the prize guys this is my t onairtel g selfie entry go participate now
154,the wait is over as the apple iphone and iphone plus product red editions are now available in india here a
155,rt iphone plus case iphone plus case for off iphone iphone plus iphone iphone plus phonecase deals g
156,win one of these iphonex iphone just retweet follow us comment the one you want giveaway phone
157,iphone charger rephoenix lightning cable m pack nylon braided iphone cable for iphone iphone iphone p
158,rt bestand in airpods apple watch iphone stand iphone applewatch airpods iphonex iphone tech
159,win one of these iphonex iphone just retweet follow us comment the one you want giveaway phone
160,rt win one of these iphonex amp iphone just retweet amp follow us comment the one you want
161,iphone is the prize guys this is my t onairtel g selfie entry go participate now
162,here s my entry for the my g t onairtel g selfie for a chance to win the iphone you can win one
163,this is my airtel g t onairtel g selfie share your selfies too guys an iphone is up for grabs
164,iphone special edition price in india iphone red iphone appleevent
165,win one of these iphonex iphone just retweet follow us comment the one you want giveaway phone
166,rt have you entered our giveaway yet one lucky winner will receive a brand new iphone visit our profile for the origi
167,rt did you remember to enter our giveaway there s a brand new iphone in it for the winner follow us and rt the ori
168,rt there s only two weeks left until we announce the winner of our iphone giveaway if you haven t already follow us
169,rt have you entered our giveaway yet if not head on over to our profile and retweet the original tweet for your chance
170,this is my airtel g t onartel g selfie get checking guys you can win iphone every day
171,pretty case in my casetify shop butterfly butterflies moths casetifyartist iphone summer trend iphone
172,want to win an iphone kanungo start sharing your airtel g t onairtel g selfie
173,iphone case iphone case yoyamo crystal clear case cover shock absorption case with soft tpu gel bumper for iph
174,any ideas will not connect with ipad just updated software on it and iphone
175,rt product red iphone plus the product red leather folio case for iphone x more
176,rt my iphone just failed a durability test and all i think of is bendgate iphone iphone apple ben
177,smartphone wallpaper info landscape colorful contrail iphone wallpaper
178,rt come check out the peterborough on april th this saturday pm to pm for some great unlimitedplans
179,landscape colorful contrail iphone wallpaper
180,iphone gold
181,belkin has unveiled its new wireless charging pad for iphone iphone plus and iphonex
182,this is my airtel g t onairtel g selfie get clicking guys you can win an iphone every day
183,this is my selfie for s g t cricket season you guys can also share your selfies and stand a chanc
184,rt product red iphone plus the product red leather folio case for iphone x more iphone iphone
185,iphone iphone plus product red versions launched in india pre orders live now
186,apple has launched its iphone and iphone plus models in red edition in india on april
187,rt i called the helpline that tweeted me looks like i have to cancel my pandora pr
188,rt lopez apple released ios for users with touchscreen problem who repaired their iphone with an unofficial display
189,rt wireless charger yootech wireless charging pad for iphone x iphone plus save on your order use coupon code wa
190,puridea portable charger mah power bank bi color li polymer external battery for iphone samsung htc lg black
191,product red iphone plus the product red leather folio case for iphone x more
192,rt my selfie with g t onairtel g hope to win an iphone participate now click this link
193,guys just participate in the t onairtel g contest and you could win an iphone sounds interesting so for what
194,rt iphone and iphone plus product red special edition listed on flipkart price specifications and offers
195,iphone red
196,win one of these iphonex amp iphone just retweet amp follow us comment the one you want giveaway phone
197,iphone plus case iphone plus case for off iphone iphone plus iphone iphone plus phonecase
198,rt apple vs samsung ios vs android apicturespeaksathousandwords what do you guys think of this are you apple or sam
199,luster bling swarovski crystal iphone and iphone plus case iphone iphonex blingbling click here
200,rt iphone for the champs congratulations blue eaglets
201,special edition iphone iphone plus available for purchase in india middaynews technews iphoneinindia
202,rt iphone gb will cost rs while gb variant will be available for rs iphone
203,iphone gb will cost rs while gb variant will be available for rs iphone
204,rt product red an advocacy group combating hiv aids in africa has partnered up with apple for the product red iphone and
205,never worry about running out of battery again volta magnetic charger has got you covered android ios
206,win one of these iphonex iphone just retweet follow us comment the one you want giveaway phone
207,specification features of special edition iphone iphone plus available in india read more
208,iphone iphone plus product red editions launched in india prices start at rs via
209,left or right comment down below follow to see more iphone iphone iphone plus
210,iphone iphone plus product red versions launched in india pre orders starts
211,iphone and iphone plus product red editions are red for a cause tech techblogger
212,rt authorities in the us are using a device called graykey to unlock iphones reportedly even works on iphones running apple s
213,iphone and iphone plus product red special edition listed on flipkart price specifications and offers
214,rt hhhhhhhhh iphone
215,rt the new red iphone is now available in india
216,watch iphone se hands on video shows a headphone jack apple iphonese iphonex iphonese iphone
217,both iphone and plus red edition are available from preorder digi celcom apple iphone
218,rt winter may be over but the winter waves design doesn t have to be be sure to signup at for e
219,special edition iphone iphone plus now in india technology apple
220,the new red iphone is now available in india
221,win one of these iphonex iphone just retweet follow us comment the one you want giveaway phone
222,for iphone x s iphone plus case ultra slim hybrid protective hard cover item
223,special edition iphone iphone plus now in india
224,pdca iphone ionic newapp it is pocketpdca that you can use easily pdca cycle on your smartphone youtube
225,smartphone wallpaper info black and white pattern character iphone wallpaper
226,black and white pattern character iphone wallpaper
227,win one of these iphonex iphone just retweet follow us comment the one you want giveaway phone
228,botanical flower iphone case flower botanical iphone iphone iphonex
229,loving hearts bling swarovski crystal iphone and iphone plus case iphone iphonex blingbling click here
230,apple s special edition iphone and iphone plus in red colour will be available for purchase in india from friday
231,special edition iphone iphone plus available in india check price specialedition iphone iphone plus in
232,rt apple iphone product red iphone plus red are available in stores in india online today onwards go grab your r
233,my selfie with g t onairtel g hope to win an iphone participate now click this link
234,apple iphone product red iphone plus red are available in stores in india online today onwards go grab
235,beautiful places cover for iphone s iphone iphonex
236,iphone silicone phone cover with attractive whale print via
237,pre order iphone iphone plus in india on to go on sale on april
238,apple iphone iphone plus product red now available in india prices start at rs
